[
  {
    "revision_id": "d6c92c03-c074-4197-9c5b-2c9d9764e7e8",
    "run_id": "14ef0e78246349f6",
    "stage_id": "deconstruct",
    "parent_revision_ids": [],
    "timestamp": "2026-09-05T22:06:56.152Z",
    "stage_attempt": 1,
    "feedback_round": 0,
    "input_hash": "582c98d0c84f0c6eeffb374a3956c08953ff50af359fb1503adfda411e83e4db",
    "output_hash": "0d27c272302ab7275b1782d8a449112873acf356b4d53cad8c14a7d8d9c6e90b",
    "input_ref": "npx:stage-input:5ae63465185d01f0636da7d48513e050c5184206e00311d6cb9408030739c726:local-bundle",
    "output_ref": "npx:stage-output:0d27c272302ab7275b1782d8a449112873acf356b4d53cad8c14a7d8d9c6e90b:local-bundle",
    "gate_results": [],
    "status": "DEMO",
    "freshness": "FRESH",
    "provider_used": null,
    "execution_provenance": {
      "core_build_hash": "cli",
      "contract_versions": {
        "gate-result": "1.3.0",
        "provider-failure": "1.1.0",
        "pipeline-outcome": "1.0.0",
        "revision-entry": "2.0.0",
        "observability-event": "1.3.0",
        "eval-run": "2.0.0",
        "comparison": "2.3.0",
        "configuration": "1.3.0",
        "judge-verdict": "1.2.0"
      },
      "provider_model_fingerprint": null,
      "config_fingerprint": null
    },
    "retention_scope": "LOCAL_BUNDLE"
  },
  {
    "revision_id": "ae9de65a-f057-41a3-8001-d61176310ed5",
    "run_id": "14ef0e78246349f6",
    "stage_id": "calibrate",
    "parent_revision_ids": [
      "d6c92c03-c074-4197-9c5b-2c9d9764e7e8"
    ],
    "timestamp": "2026-09-05T22:06:56.159Z",
    "stage_attempt": 1,
    "feedback_round": 0,
    "input_hash": "b00c5881d3626c0ec344be2107c9a3ec4433a5f32c7b8e81b139436a14deb234",
    "output_hash": "3b0278b6a8c068024263013c89c9d256e54c7ddb3531877908d377a76d19fe86",
    "input_ref": "npx:stage-input:7cc6e27dff7adecb172cbb44f3a96add2d016eda5d4273def56f53294a02c153:local-bundle",
    "output_ref": "npx:stage-output:3b0278b6a8c068024263013c89c9d256e54c7ddb3531877908d377a76d19fe86:local-bundle",
    "gate_results": [],
    "status": "DEMO",
    "freshness": "FRESH",
    "provider_used": null,
    "execution_provenance": {
      "core_build_hash": "cli",
      "contract_versions": {
        "gate-result": "1.3.0",
        "provider-failure": "1.1.0",
        "pipeline-outcome": "1.0.0",
        "revision-entry": "2.0.0",
        "observability-event": "1.3.0",
        "eval-run": "2.0.0",
        "comparison": "2.3.0",
        "configuration": "1.3.0",
        "judge-verdict": "1.2.0"
      },
      "provider_model_fingerprint": null,
      "config_fingerprint": null
    },
    "retention_scope": "LOCAL_BUNDLE"
  },
  {
    "revision_id": "f1cc560b-c7ae-44a2-a3b9-2929806d0832",
    "run_id": "14ef0e78246349f6",
    "stage_id": "compile",
    "parent_revision_ids": [
      "ae9de65a-f057-41a3-8001-d61176310ed5"
    ],
    "timestamp": "2026-09-05T22:06:56.169Z",
    "stage_attempt": 1,
    "feedback_round": 0,
    "input_hash": "230d3b392ad9b6d5bb818300f60d63be442762bf5b37452f65e3c0118390baad",
    "output_hash": "0bbbf7c963bff2b8c4dfba4c92ad0bae675a51889952386eb309cd71b5699657",
    "input_ref": "npx:stage-input:dd195a12f3b7119bff02932f0f02b00c21429a74c4182d0399a495f5dd351a1a:local-bundle",
    "output_ref": "npx:stage-output:0bbbf7c963bff2b8c4dfba4c92ad0bae675a51889952386eb309cd71b5699657:local-bundle",
    "gate_results": [],
    "status": "DEMO",
    "freshness": "FRESH",
    "provider_used": null,
    "execution_provenance": {
      "core_build_hash": "cli",
      "contract_versions": {
        "gate-result": "1.3.0",
        "provider-failure": "1.1.0",
        "pipeline-outcome": "1.0.0",
        "revision-entry": "2.0.0",
        "observability-event": "1.3.0",
        "eval-run": "2.0.0",
        "comparison": "2.3.0",
        "configuration": "1.3.0",
        "judge-verdict": "1.2.0"
      },
      "provider_model_fingerprint": null,
      "config_fingerprint": null
    },
    "retention_scope": "LOCAL_BUNDLE"
  },
  {
    "revision_id": "fc5161b3-1faf-4388-a8d1-c2734be52aac",
    "run_id": "14ef0e78246349f6",
    "stage_id": "harden",
    "parent_revision_ids": [
      "f1cc560b-c7ae-44a2-a3b9-2929806d0832"
    ],
    "timestamp": "2026-09-05T22:06:56.171Z",
    "stage_attempt": 1,
    "feedback_round": 0,
    "input_hash": "79ac4b36a7bd96b09587e71f489aabefdd89146b3c0cf3752acb318ff4bc4cbd",
    "output_hash": "e3b0c44298fc1c149afbf4c8996fb92427ae41e4649b934ca495991b7852b855",
    "input_ref": null,
    "output_ref": null,
    "gate_results": [],
    "status": "SKIPPED",
    "freshness": "FRESH",
    "provider_used": null,
    "execution_provenance": {
      "core_build_hash": "cli",
      "contract_versions": {
        "gate-result": "1.3.0",
        "provider-failure": "1.1.0",
        "pipeline-outcome": "1.0.0",
        "revision-entry": "2.0.0",
        "observability-event": "1.3.0",
        "eval-run": "2.0.0",
        "comparison": "2.3.0",
        "configuration": "1.3.0",
        "judge-verdict": "1.2.0"
      },
      "provider_model_fingerprint": null,
      "config_fingerprint": null
    },
    "retention_scope": "LOCAL_BUNDLE"
  },
  {
    "revision_id": "40afc7c4-360b-459e-b107-d346274e7b49",
    "run_id": "14ef0e78246349f6",
    "stage_id": "lint",
    "parent_revision_ids": [
      "fc5161b3-1faf-4388-a8d1-c2734be52aac"
    ],
    "timestamp": "2026-09-05T22:06:56.173Z",
    "stage_attempt": 1,
    "feedback_round": 0,
    "input_hash": "0d122b4e158082ceeb6bdcf620c6af0f8df011d61231af36136ccb3251a6f92d",
    "output_hash": "607e062a3ee256cb7bf34c0e7db7caab14d617eddad78e897e4b65cfddc12a3e",
    "input_ref": null,
    "output_ref": null,
    "gate_results": [],
    "status": "SUCCEEDED",
    "freshness": "FRESH",
    "provider_used": null,
    "execution_provenance": {
      "core_build_hash": "cli",
      "contract_versions": {
        "gate-result": "1.3.0",
        "provider-failure": "1.1.0",
        "pipeline-outcome": "1.0.0",
        "revision-entry": "2.0.0",
        "observability-event": "1.3.0",
        "eval-run": "2.0.0",
        "comparison": "2.3.0",
        "configuration": "1.3.0",
        "judge-verdict": "1.2.0"
      },
      "provider_model_fingerprint": null,
      "config_fingerprint": null
    },
    "retention_scope": "LOCAL_BUNDLE"
  },
  {
    "revision_id": "442ee9f0-0597-4be7-ba6f-630a5615be20",
    "run_id": "14ef0e78246349f6",
    "stage_id": "preview",
    "parent_revision_ids": [
      "40afc7c4-360b-459e-b107-d346274e7b49"
    ],
    "timestamp": "2026-09-05T22:06:56.176Z",
    "stage_attempt": 1,
    "feedback_round": 0,
    "input_hash": "37aee5b9634417589dd681decd9329e7d4786629c6ce936ace05b4e3057e9a3e",
    "output_hash": "e3b0c44298fc1c149afbf4c8996fb92427ae41e4649b934ca495991b7852b855",
    "input_ref": null,
    "output_ref": null,
    "gate_results": [],
    "status": "SKIPPED",
    "freshness": "FRESH",
    "provider_used": null,
    "execution_provenance": {
      "core_build_hash": "cli",
      "contract_versions": {
        "gate-result": "1.3.0",
        "provider-failure": "1.1.0",
        "pipeline-outcome": "1.0.0",
        "revision-entry": "2.0.0",
        "observability-event": "1.3.0",
        "eval-run": "2.0.0",
        "comparison": "2.3.0",
        "configuration": "1.3.0",
        "judge-verdict": "1.2.0"
      },
      "provider_model_fingerprint": null,
      "config_fingerprint": null
    },
    "retention_scope": "LOCAL_BUNDLE"
  },
  {
    "revision_id": "22cef752-42dd-46c2-b9bd-34d35766534b",
    "run_id": "14ef0e78246349f6",
    "stage_id": "cost_estimate",
    "parent_revision_ids": [
      "442ee9f0-0597-4be7-ba6f-630a5615be20"
    ],
    "timestamp": "2026-09-05T22:06:56.179Z",
    "stage_attempt": 1,
    "feedback_round": 0,
    "input_hash": "69b0703568a4098791babbeb5d6162ea361c9dd5855d3e2f02ec3de287aeeb24",
    "output_hash": "2cbf266ed9afce97e7e5c35e7328d9ea970cd4b2c4ab757ae82adc6b0e258e7d",
    "input_ref": null,
    "output_ref": null,
    "gate_results": [],
    "status": "SUCCEEDED",
    "freshness": "FRESH",
    "provider_used": null,
    "execution_provenance": {
      "core_build_hash": "cli",
      "contract_versions": {
        "gate-result": "1.3.0",
        "provider-failure": "1.1.0",
        "pipeline-outcome": "1.0.0",
        "revision-entry": "2.0.0",
        "observability-event": "1.3.0",
        "eval-run": "2.0.0",
        "comparison": "2.3.0",
        "configuration": "1.3.0",
        "judge-verdict": "1.2.0"
      },
      "provider_model_fingerprint": null,
      "config_fingerprint": null
    },
    "retention_scope": "LOCAL_BUNDLE"
  }
]